<?xml version="1.0" encoding="utf-8" ?>
<Applications xmlns:xsi="http://www.w3.org/2001/XMLSchema-instance"
xsi:noNamespaceSchemaLocation="AppsSchema.xsd">
  <Application>
    <Name>PresentationTrainer</Name>
    <Path>C:\Users\jan\source\repos\PT2016\PresentationTrainer\bin\x64\Debug\PresentationTrainer.exe</Path>
    <Remote >false</Remote>
    <TCPListener>11001</TCPListener>
    <TCPSender>12001</TCPSender>
    <TCPFile>13001</TCPFile>
    <UDPListener>14001</UDPListener>
    <UDPSender>15001</UDPSender>
    <Used>true</Used>
  </Application>
  <Application>
    <Name>notepad</Name>
    <Path>notepad.exe</Path>
    <Remote >false</Remote>
    <TCPListener>23432</TCPListener>
    <TCPSender>3</TCPSender>
    <TCPFile>13001</TCPFile>
    <UDPListener>32</UDPListener>
    <UDPSender>342</UDPSender>
    <Used>true</Used>
  </Application>
</Applications>
